{
  "$schema": "http://json-schema.org/draft-04/schema#",
  "type": "object",
  "properties": {
    "$schema": {
      "type": "string"
    },
    "code-generation": {
      "$ref": "#/definitions/CodeGeneration"
    },
    "tables": {
      "type": "array",
      "title": "List of tables discovered in the source database",
      "items": {
        "$ref": "#/definitions/Table"
      }
    },
    "views": {
      "type": "array",
      "items": {
        "$ref": "#/definitions/View"
      }
    },
    "stored-procedures": {
      "type": "array",
      "title": "List of stored procedures discovered in the source database",
      "items": {
        "$ref": "#/definitions/StoredProcedure"
      }
    },
    "functions": {
      "type": "array",
      "title": "List of scalar and TVF functions discovered in the source database",
      "items": {
        "$ref": "#/definitions/Function"
      }
    },
    "names": {
      "title": "Custom class and namespace names",
      "$ref": "#/definitions/Names"
    },
    "file-layout": {
      "title": "Custom file layout options",
      "$ref": "#/definitions/FileLayout"
    },
    "replacements": {
      "title": "Custom naming options",
      "$ref": "#/definitions/Replacements"
    },
    "type-mappings": {
      "title": "Optional type mappings",
      "$ref": "#/definitions/TypeMappings"
    }
  },
  "definitions": {
    "Table": {
      "type": "object",
      "properties": {
        "name": {
          "type": "string",
          "title": "Full table name"
        },
        "exclude": {
          "type": "boolean",
          "title": "Set to true to exclude this table from code generation"
        },
        "exclusionWildcard": {
          "type": "string",
          "title": "Exclusion pattern with * symbol, use '*' to exclude all by default"
        },
        "excludedColumns": {
          "type": "array",
          "default": [],
          "title": "Columns to Exclude from code generation",
          "items": {
            "type": "string",
            "title": "Column"
          }
        },
        "excludedIndexes": {
          "type": "array",
          "default": [],
          "title": "Indexes to Exclude from code generation",
          "items": {
            "type": "string",
            "title": "Index"
          }
        }
      }
    },
    "View": {
      "type": "object",
      "properties": {
        "name": {
          "type": "string"
        },
        "exclusionWildcard": {
          "type": "string",
          "title": "Exclusion pattern with * symbol, use '*' to exclude all by default"
        },
        "excludedColumns": {
          "type": "array",
          "default": [],
          "title": "Columns to Exclude from code generation",
          "items": {
            "type": "string",
            "title": "Column"
          }
        }
      }
    },
    "StoredProcedure": {
      "type": "object",
      "title": "Stored procedure",
      "properties": {
        "name": {
          "type": "string",
          "title": "The stored procedure name"
        },
        "exclude": {
          "type": "boolean",
          "default": false,
          "title": "Set to true to exclude this stored procedure from code generation",
          "examples": [
            true
          ]
        },
        "use-legacy-resultset-discovery": {
          "type": "boolean",
          "default": false,
          "title": "Use sp_describe_first_result_set instead of SET FMTONLY for result set discovery"
        },
        "generate-empty-result-type": {
          "type": "boolean",
          "default": false,
          "title": "Generate empty result class for this stored procedure when result set cannot be discovered. When false (default), uses SqlQueryRaw directly."
        },
        "mapped-type": {
          "type": "string",
          "default": null,
          "title": "Name of an entity class (DbSet) in your DbContext that maps the result of the stored procedure "
        },
        "exclusionWildcard": {
          "type": "string",
          "title": "Exclusion pattern with * symbol, use '*' to exclude all by default"
        }
      }
    },
    "Function": {
      "type": "object",
      "title": "Function",
      "properties": {
        "name": {
          "type": "string",
          "title": "Name of function"
        },
        "exclude": {
          "type": "boolean",
          "default": false,
          "title": "Set to true to exclude this function from code generation"
        },
        "exclusionWildcard": {
          "type": "string",
          "title": "Exclusion pattern with * symbol, use '*' to exclude all by default"
        }
      }
    },
    "CodeGeneration": {
      "type": "object",
      "title": "Options for code generation",
      "required": [
        "enable-on-configuring",
        "type",
        "use-database-names",
        "use-data-annotations",
        "use-nullable-reference-types",
        "use-inflector",
        "use-legacy-inflector",
        "use-many-to-many-entity",
        "use-t4",
        "remove-defaultsql-from-bool-properties",
        "soft-delete-obsolete-files",
        "use-alternate-stored-procedure-resultset-discovery",
        "use-stored-procedure-resultset-fallback"
      ],
      "properties": {
        "enable-on-configuring": {
          "type": "boolean",
          "title": "Add OnConfiguring method to the DbContext"
        },
        "file-charset": {
          "default": "utf-8-bom",
          "enum": [ "utf-8-bom", "utf-8" ],
          "type": "string",
          "title": "Character set for generated files"
        },
        "file-line-endings": {
          "default": "native",
          "enum": [ "lf", "crlf", "native" ],
          "type": "string",
          "title": "Line ending style for generated files"
        },
        "type": {
          "default": "all",
          "enum": [ "all", "dbcontext", "entities" ],
          "type": "string",
          "title": "Type of files to generate"
        },
        "use-database-names": {
          "type": "boolean",
          "title": "Use table and column names from the database"
        },
        "use-data-annotations": {
          "type": "boolean",
          "title": "Use DataAnnotation attributes rather than the fluent API (as much as possible)"
        },
        "use-nullable-reference-types": {
          "type": "boolean",
          "title": "Use nullable reference types"
        },
        "use-inflector": {
          "type": "boolean",
          "default": true,
          "title": "Pluralize or singularize generated names (entity class names singular and DbSet names plural)"
        },
        "use-legacy-inflector": {
          "type": "boolean",
          "title": "Use EF6 Pluralizer instead of Humanizer"
        },
        "use-many-to-many-entity": {
          "type": "boolean",
          "title": "Preserve a many to many entity instead of skipping it "
        },
        "use-max-size-for-string-input-parameters": {
          "type": "boolean",
          "default": false,
          "title": "Use Size 8000 for VARCHAR and 4000 for NVARCHAR input-only stored procedure parameters, preserving MAX and output parameter sizes"
        },
        "use-t4": {
          "type": "boolean",
          "title": "Customize code using T4 templates"
        },
        "use-t4-split": {
          "type": "boolean",
          "default": false,
          "title": "Customize code using T4 templates including EntityTypeConfiguration.t4.  This cannot be used in combination with use-t4 or split-dbcontext-preview"
        },
        "remove-defaultsql-from-bool-properties": {
          "type": "boolean",
          "title": "Remove SQL default from bool columns to avoid them being bool?"
        },
        "soft-delete-obsolete-files": {
          "type": "boolean",
          "default": true,
          "title": "Run Cleanup of obsolete files (on Linux and macOS, files are permanently deleted)"
        },
        "discover-multiple-stored-procedure-resultsets-preview": {
          "type": "boolean",
          "title": "Discover multiple result sets from SQL stored procedures (preview)"
        },
        "use-alternate-stored-procedure-resultset-discovery": {
          "type": "boolean",
          "title": "Use alternate result set discovery - use sp_describe_first_result_set to retrieve stored procedure result sets"
        },
        "use-stored-procedure-resultset-fallback": {
          "type": "boolean",
          "default": true,
          "title": "Use fallback result set discovery by reading the stored procedure definition from SQL Server system tables when metadata discovery fails"
        },
        "t4-template-path": {
          "type": [ "string", "null" ],
          "title": "Global path to T4 templates"
        },
        "use-no-navigations-preview": {
          "type": "boolean",
          "title": "Remove all navigation properties from the generated code (preview)"
        },
        "merge-dacpacs": {
          "type": "boolean",
          "title": "Merge .dacpac files (when using .dacpac references)"
        },
        "refresh-object-lists": {
          "type": "boolean",
          "default": true,
          "title": "Refresh the lists of objects (tables, views, stored procedures, functions) from the database in the config file during scaffolding"
        },
        "generate-mermaid-diagram": {
          "type": "boolean",
          "title": "Create a markdown file with a Mermaid ER diagram during scaffolding"
        },
        "use-decimal-data-annotation-for-sproc-results": {
          "type": "boolean",
          "title": "Use explicit decimal annotation for store procedure results",
          "default": true
        },
        "use-prefix-navigation-naming": {
          "type": "boolean",
          "title": "Use prefix based naming of navigations with EF Core 8 or later"
        },
        "use-database-names-for-routines": {
          "type": "boolean",
          "title": "Use stored procedure, stored procedure result and function names from the database",
          "default": true
        },
        "use-internal-access-modifiers-for-sprocs-and-functions": {
          "type": "boolean",
          "title": "When generating the stored procedure and function classes and helpers, set them to internal instead of public.",
          "default": false
        }
      }
    },
    "Names": {
      "type": "object",
      "title": "Custom class and namespace names",
      "required": [
        "dbcontext-name",
        "root-namespace"
      ],
      "properties": {
        "root-namespace": {
          "type": "string",
          "title": "Root namespace"
        },
        "dbcontext-name": {
          "type": "string",
          "title": "Name of DbContext class"
        },
        "dbcontext-namespace": {
          "type": [ "string", "null" ],
          "title": "Namespace of DbContext class"
        },
        "model-namespace": {
          "type": [ "string", "null" ],
          "title": "Namespace of entities"
        }
      }
    },
    "FileLayout": {
      "type": "object",
      "title": "Custom file layout options",
      "required": [
        "output-path"
      ],
      "properties": {
        "output-path": {
          "type": "string",
          "default": "Models",
          "title": "Output path"
        },
        "output-dbcontext-path": {
          "type": [ "string", "null" ],
          "title": "DbContext output path"
        },
        "split-dbcontext-preview": {
          "type": "boolean",
          "title": "Split DbContext (preview)"
        },
        "use-schema-folders-preview": {
          "type": "boolean",
          "title": "Use schema folders (preview)"
        },
        "use-schema-namespaces-preview": {
          "type": "boolean",
          "title": "Use schema namespaces (preview)"
        }
      }
    },
    "TypeMappings": {
      "type": "object",
      "title": "Optional type mappings",
      "properties": {
        "use-DateOnly-TimeOnly": {
          "type": "boolean",
          "title": "Map date and time to DateOnly/TimeOnly (mssql)"
        },
        "use-HierarchyId": {
          "type": "boolean",
          "title": "Map hierarchyId (mssql)"
        },
        "use-spatial": {
          "type": "boolean",
          "title": "Map spatial columns"
        },
        "use-NodaTime": {
          "type": "boolean",
          "title": "Use NodaTime"
        }
      }
    },
    "Replacements": {
      "type": "object",
      "title": "Custom naming options",
      "properties": {
        "preserve-casing-with-regex": {
          "type": "boolean",
          "title": "Preserve casing with regex when custom naming"
        },
        "irregular-words": {
          "type": "array",
          "title": "Irregular words (words which cannot easily be pluralized/singularized) for Humanizer's AddIrregular() method.",
          "items": {
            "$ref": "#/definitions/IrregularWord"
          }
        },
        "uncountable-words": {
          "type": "array",
          "title": "Uncountable (ignored) words for Humanizer's AddUncountable() method.",
          "items": {
            "$ref": "#/definitions/UncountableWord"
          }
        },
        "plural-rules": {
          "type": "array",
          "title": "Plural word rules for Humanizer's AddPlural() method.",
          "items": {
            "$ref": "#/definitions/RuleReplacement"
          }
        },
        "singular-rules": {
          "type": "array",
          "title": "Singular word rules for Humanizer's AddSingular() method.",
          "items": {
            "$ref": "#/definitions/RuleReplacement"
          }
        }
      }
    },
    "IrregularWord": {
      "type": "object",
      "title": "Irregular word rule",
      "properties": {
        "singular": {
          "type": "string",
          "title": "Singular form"
        },
        "plural": {
          "type": "string",
          "title": "Plural form"
        },
        "match-case": {
          "type": "boolean",
          "title": "Match these words on their own as well as at the end of longer words. True by default."
        }
      }
    },
    "UncountableWord": {
      "type": "string",
      "title": "Word list"
    },
    "RuleReplacement": {
      "type": "object",
      "title": "Humanizer RegEx-based rule and replacement",
      "properties": {
        "rule": {
          "type": "string",
          "title": "RegEx to be matched, case insensitive"
        },
        "replacement": {
          "type": "string",
          "title": "RegEx replacement"
        }
      }
    }
  }
}
